text,label
when the malicious Word document opens it fetches the next payload from the remote server:,T1105
it fetched an additional script payload,T1105
a different method of fetching and executing the next stage payload,T1105
"a file downloaded from the internet,",T1105
fetch the next stage payload.,T1105
If the fetched data by cURL command,T1105
Fetch the payload with cURL command,T1105
fetching the next stage payload,T1105
fetching a remote payload,T1105
fetches a payload from the embedded URL and loads it.,T1105
launch of a suspicious batch file.,T1059.003
Windows Batch script,T1059.003
the operator executed several Windows commands,T1059.003
cmd.exe /c,T1059.003
cmd /c,T1059.003
cmd /c,T1059.003
batch file,T1059.003
The batch file name,T1059.003
the scriptlet of the batch file,T1059.003
"cmd.exe"" /c",T1059.003
"cmd.exe"" /c",T1059.003
Windows Batch file,T1059.003
This script is for executing the PowerShell script via a Windows scheduled task,T1053.005
Windows displays a warning message when the user tries to open a file downloaded from the internet.,T1204.002
strategy to persuade the victim to execute the malicious shortcut file,T1204.002
executed when the victim double-clicked on the shortcut file,T1204.002
the executable ieinstal.exe was used to bypass UAC.,T1548.002
one victim in the UAE was attacked using a malicious Word document,T1566.001
to gather basic system information.,T1082
rundll32.exe,T1218.011
spawns it with the rundll32.exe command with the payload URL,T1218.011
Embedded files of ISO image,T1027
an encrypted Dump.bin file,T1027
downloader contains an encrypted configuration at the end of the file.,T1027
the supplied encrypted decoy document.,T1027
an encrypted decoy document,T1027
The PDF and executable files have numerous spaces before the file extension to hide it and allay suspicions.,T1027
decodes 0x3E8 bytes with that key,T1140
The decrypted data,T1140
loads the decrypted DLL file,T1140
The malware decrypts the configuration data with the RC4 algorithm using an embedded 64-byte key.,T1140
the malware decrypts the payload with a delivered 64-byte RC4 key.,T1140
the decrypted payload,T1140
"checks for the names of the following antivirus vendors: Sophos, Kaspersky, Avast, Avira, Bitdefender, TrendMicro, and Windows Defender",T1518.001
"If TrendMicro, BitDefender, or Windows Defender products are installed",T1518.001
If Windows Defender or Bitdefender Antivirus is installed on the victim’s computer,T1518.001
depending on the antivirus installed.,T1518.001
the malware can disable the functionalities of EDR/AV products.,T1562.001
injects the fetched payload into the explorer.exe process,T1055
The Blockchain.pdf file is a malicious HTML application file,T1027
This evasion technique overwrites the .text section of the pre-loaded ntdll library with the freshly loaded one so that the hooked API addresses are recovered with the original API address,T1027
"The campaigns used a variety of email attachments such as Microsoft OneNote attachments and somewhat rare to see .URL attachments,",T1566.001
This campaign began with thread hijacked emails which contained HTML attachments.,T1566.001
"The HTML attachments used HTML Smuggling to drop a password protected, zipped Windows Script File (WSF).",T1027
to download and execute an intermediate script which then downloaded and executed the Standard IcedID Loader using a non-standard export “init”.,T1105
used to download and execute an IcedID loader.,T1105
opened it would initiate the download of a batch (.bat) file.,T1105
The batch file would download and execute,T1105
"When opened, the OneNote document instructed the recipient to ""open"" the document by double-clicking the button displayed in the OneNote document.",T1204.002
"file was concealed beneath the ""open"" text which, if clicked, executed the HTA file.",T1204.002
containing the encrypted bot and DLL loader.,T1027
download of a batch (.bat) file.,T1059.003
The batch file would download and execute,T1059.003
"that contained various bat files,",T1059.003
execute an IcedID loader with rundll32,T1218.011
loader with rundll32,T1218.011
Config decryption within IcedID Lite Loader.,T1140
Decryption of the URI within,T1140
The domain is decrypted from the configuration and the URI path is decrypted within the function,T1140
Decryption is the same across both,T1140
This pattern of decrypting strings,T1140
the Forked Loader decrypts and copies strings into global variables where they will be later used to resolve required functions.,T1140
Decryption of the config buffer in the Forked Loader.,T1140
With the config decrypted,T1140
"The response gets decrypted with the IcedID decryption routine,",T1140
Contains code to decrypt strings and domains,T1140
String decryption of the DLL names,T1140
"With the DLL strings decrypted, the malware then decrypts the loader configuration by taking the first 64 bytes and XORing it against the next 64 bytes.",T1140
The first four bytes of the decrypted buffer will contain the project identifier,T1140
This function decrypts strings,T1140
decrypts the DLL strings to be used later to resolve handles to the DLLs needed,T1140
The strings are decrypted in the same algorithm where the data is split into DWORDs and XOR’d against a random key.,T1140
String decryption for the DLL names needed for execution.,T1140
"Decryption of “Lite Loader”"" domains.",T1140
a function is called that decrypts strings that,T1140
there are two domains that are decrypted:,T1140
"With the domain names decrypted, the DLL Loader decrypts 10 strings that should be URIs to be appended to the domains.",T1140
Decryption of “Lite Loader” filenames.,T1140
After the strings are decrypted,T1140
Base64 decoding this value,T1140
following base64 decoded header,T1140
showing the decrypted botpack structure.,T1140
that makes the HTTP request.,T1071.001
sends an HTTP request that will contain the encrypted bot response.,T1071.001
contain the host information,T1082
The Base-64 encoded segment,T1027
may also deliver a weaponized Office document that executes the ReconShark reconnaissance malware.,T1566.001
to distribute password-protected weaponized Office documents,T1566.001
Office documents weaponized,T1566.001
hardware information.,T1082
to use this tool for remote management of its infrastructure.,T1219
"webshells, mostly obfuscated,",T1027
the hacker also changes the content of the file RedirSuiteServiceProxy.aspx to webshell content.,T1036.005
RedirSuiteServiceProxy.aspx is a legitimate file name available in the Exchange server.,T1036.005
"the attacker downloads files,",T1105
drops suspicious files on the attacked servers,T1105
"collecting information on the system,",T1005
“cmd” /c,T1059.003
"""cmd"" /c",T1059.003
the standard Windows command line tool cmd.exe.,T1059.003
Delete file or folder,T1070.004
"the hacker also injects malicious DLLs into the memory,",T1055
the DLL was injected into the memory of the svchost.exe process,T1055
executes these files through WMIC.,T1047
", the above files no longer exist on the compromised system, possibly due to the hacker’s evidence deletion.",T1027
Decrypt the request received using AES algorithm,T1140
"After decoding,",T1140
creates a listener that listens for connections to port 443 at the path https://*:,T1071.001
This method is responsible for collecting system information,T1082
"Information such as operating system architecture, framework version, operating system version, etc.",T1082
listing directory and file information in the format D|-|<Date created> |<Date modified> |<folder or file name>,T1083
reading files,T1083
Sending and receiving data with C2 using the RC4 encryption algorithm where the key will be generated at runtime.,T1573.001
delivered via phishing email as an attachment,T1566.001
The archives often include a JavaScript (.js) file,T1027
likely exploited known vulnerabilities in unpatched applications for initial access,T1190
gains access to the targets through remote exploitation of an unpatched internet-facing device.,T1190
"to perform initial intrusion leveraging exposed vulnerable applications, for example, continuing to exploit Log4j 2 vulnerabilities in unpatched systems in",T1190
"Installing legitimate remote access tools, such as RPort, Ligolo and eHorus",T1219
common native Windows tools and commands such as netstat,T1016
Windows Management Instrumentation (WMI) to launch commands on devices,T1047
Remote scheduled tasks to launch their customized PowerShell backdoor,T1053.005
to register a scheduled task used to launch the ransomware payload.,T1053.005
The threat actors consistently perform extensive lateral movement actions using the acquired credentials within a targeted environment.,T1078
GPO was leveraged again to register a scheduled task used to launch the ransomware payload.,T1484.001
first interfered with security tools using Group Policy Objects (GPO).,T1484.001
the threat actors leveraged highly privileged credentials and access to domain controllers,T1078
The threat actors used the compromised administrator account,T1078
the threat actors had to first compromise two privileged accounts and leverage them to manipulate the Azure Active Directory (Azure AD) Connect agent.,T1078
"the threat actors first used a compromised, highly privileged account to access the device where the Azure Active Directory (Azure AD) Connect agent is installed.",T1078
"The first account was the compromised Azure AD Connector account,",T1078
the threat actors were observed using compromised credentials to access the Azure AD Connect device.,T1078
authentication from a known attacker IP address into the Azure AD Connector cloud account.,T1078
the threat actors executed multiple actions in the cloud using two privileged accounts.,T1078
The Azure AD Connector account and the compromised administrator account were then used to perform,T1078
a successful sign-in to the Microsoft Azure environment was observed.,T1078
The threat actors then used these credentials to pivot from the on-premises environment to the Azure AD environment.,T1078
the threat actors leveraged RDP for access into the account.,T1021.001
"the threat actors accessed it through RDP, which is an open session that evades MFA blocking their activities.",T1021.001
"Those files will still get executed, if the user clicks on run",T1204.002
As LSASS dumps are nowadays recognized by the dump file itself,T1003.001
LSASS dump in c:\tmp detected and deleted,T1003.001
LSASS dump in the WebDAV detected,T1003.001
"done via the GetAsyncKeyState API,",T1106
this is done via the popen API,T1106
uses Windows API functions to execute files,T1106
"This is done via the GetAsyncKeyState API, with keystrokes being logged",T1056.001
"keylogging are enabled by default,",T1056.001
logs keystrokes for windows with titles containing substrings specified in its configuration,T1056.001
Window titles to keylog,T1056.001
can log keystrokes.,T1056.001
"Screenshots and keylogging are enabled by default,",T1113
can capture screenshots,T1113
"the shellcode is stored in files instead of the registry, and the stored shellcode is loaded and executed on Dolphin’s startup",T1547.001
"The backdoor periodically checks and creates its own persistence by making sure that Step 1 of the loader is run every time the system is started, via a registry Run value, in the same way as in the installer: HKCU\Software\Microsoft\Windows\CurrentVersion\Run\<random_run_name>\”%appdata%\Python27({32|64})\pythonw.exe” “<loader_step_1>” “<loader_encrypted_step_2>”",T1547.001
uses Run keys for persistence of its loader,T1547.001
can execute she will commands,T1059.003
creates directory listings,T1083
The command to get specific files,T1083
It creates directory listings,T1083
to get files from drives,T1083
it searches the drives of compromised systems for interesting files,T1083
can obtain file and directory listings.,T1083
"The following file extensions of interest, specific to media, documents, emails, and certificates,",T1005
can collect files from local drives.,T1005
Username,T1033
obtains the victim’s username.,T1033
Computer name,T1082
RAM size and usage,T1082
OS version,T1082
"obtains various system information including OS version, computer name and RAM size.",T1082
List of installed security products,T1518.001
obtains a list of installed security software.,T1518.001
Local and external IP address,T1016
obtains the device’s local and external IP address.,T1016
XOR-decrypts an embedded PE file,T1140
"XOR-decrypts further shellcode carried within itself,",T1140
"XOR-decrypts its contents,",T1140
a decrypted configuration,T1140
injects it into the created process,T1055
in a specified separate process that is created and injected.,T1055
and inject processes.,T1055
it creates a one-time scheduled task.,T1053.005
uses a temporary scheduled task to start after installation.,T1053.005
"After execution, the output of commands is uploaded.",T1041
exfiltrates data to Google Drive storage,T1041
it searches the drives of compromised systems for interesting files and exfiltrates them to Google Drive.,T1041
exfiltrates data to Google Drive.,T1041
"The shellcode is stored in the registry,",T1112
sending an HTTP POST request,T1071.001
uses HTTPS to communicate with Google Drive.,T1071.001
staging the data in encrypted ZIP archives before upload.,T1074.001
stages collected data in a directory before exfiltration,T1074.001
"The content is encrypted using AES CBC with random 16-byte keys and IVs,",T1027
Most strings in this version are base64 encoded.,T1027
The base64-encoded strings were plaintext again in this version.,T1027
has encrypted components.,T1027
"another shellcode, XOR-decrypts an embedded PE file – the Dolphin backdoor – and loads and executes it using a custom PE loader.",T1055
"which is vulnerable to a DLL side-loading vulnerability, and loads a file",T1574.002
"sideloading different DLL names, and multiple binary files names being loaded by those DLLs.",T1574.002
the executables and sideloaded files,T1574.002
Side-loaded DLL name,T1574.002
a threat actor abusing a sideloading vulnerability,T1574.002
Name of the malicious side-loaded DLL,T1574.002
Name of the executable vulnerable to side loading,T1574.002
seemingly legitimate executables and their respective sideloaded files,T1574.002
encoded shellcode,T1027
Creates a memory section with the DES-encrypted malware configuration,T1027
to obfuscate their malware.,T1027
used VMProtect to obfuscate one of them.,T1027
that decompresses and loads the first stage in memory.,T1140
shellcode decompressing and loading,T1140
there was only one stage being decrypted in memory,T1140
the malware decrypts the saved passwords,T1140
and then decrypts them,T1140
and then decrypts the content,T1140
calls Stage 1 again via process hollowing with four parameters,T1055
It then runs Stage 2 via process hollowing.,T1055
creates a registry key,T1112
a service that launches the moved executable rc.exe with one parameter.,T1569.002
Screenshot grab,T1113
Drive information retrieval,T1083
browses a directory,T1083
Process manager (browses and terminates processes),T1057
Current process ID,T1057
"deletes,",T1070.004
"uploads, downloads a file",T1105
Command execution,T1059.003
by calling the GetNetworkParams API function,T1106
Collected machine information includes the following: Randomly generated GUID Hostname,T1082
Processor architecture,T1082
Operating system version,T1082
Username,T1033
Local IP address and port used to send the network packet,T1016
The configuration is encrypted with a hardcoded DES key and is a few bytes long,T1573.001
the malware retrieves information on the infected machine and sends it to the C&C encrypted with DES.,T1573.001
"information is sent to the C&C, encrypted with a hardcoded key and DES CBC algorithm:",T1573.001
the malware retrieves information on the infected machine and sends it to the C&C,T1041
"Then, the malware retrieves information on the compromised computer and sends it to the C&C.",T1041
used as a lure to entice the victim into opening the malicious file.,T1204.002
"to extract the URL, login, and password fields from the file",T1552.001
Name of the hardcoded directory where files are copied,T1074.001
The malware also established persistence on the host with the creation of a registry run key.,T1547.001
persistence was achieved by creating a ‘Run’ key,T1547.001
These files were transferred to the domain controller over SMB.,T1570
dumped lsass memory on the domain controller.,T1003.001
We observed a process created by Cobalt Strike accessing lsass.exe,T1003.001
is a known indicator of such tools as Mimikatz,T1003.001
most likely using credentials gathered by the previous LSASS access.,T1003.001
then proceeded to access lsass memory on the host to extract credentials.,T1003.001
the threat actor became active by initiating a proxied RDP connection via the Cobalt Strike beacon to the domain controller.,T1021.001
after completing RDP connections to various hosts on the network,T1021.001
which were started via their interactive RDP session,T1021.001
RDP was also used by the threat actor,T1021.001
The threat actor was able to RDP to a backup server,T1021.001
running processes were reviewed,T1057
the threat actors checked running processes on the accessed hosts via taskmanager,T1057
"checking on running tasks,",T1057
the folder included a legitimate copy of rundll32.exe,T1218.011
rundll32.exe binary downloaded approximately 0.4 MB of data.,T1218.011
using a renamed copy of rundll32.,T1218.011
Batch script to run,T1059.003
file would execute a batch script,T1059.003
"""C:\Windows\syswow64\cmd.exe"" /C",T1059.003
An instance of cmd.exe was launched through explorer.exe which ran the following command,T1059.003
cmd.exe session,T1059.003
The threat actor also used a batch script to collect a list of all computer objects on the domain using C:\Windows\system32\cmd.exe /C adcomp.bat which contained the PowerShell command:,T1059.003
"Once the user had mounted the ISO and the LNK file was executed by the user, the complex execution flow started.",T1204.002
The names of the registry values changed,T1112
The last registry key was used to store additional PowerShell code.,T1112
"This script called a combination of QueueUserAPC, GetCurrentThreadId, OpenThread, and VirtualAlloc",T1106
the threat actor injected into various processes,T1055
reg.exe query,T1012
started a BITS job to download a Cobalt Strike beacon,T1105
whoami,T1016
whoami /groups,T1016
ipconfig /all,T1016
threat actor first ran some initial discovery on the host using built-in Windows utilities like ipconfig,T1016
systeminfo,T1082
systeminfo,T1082
WMI was used to pivot to a domain controller on the network.,T1047
The actor leveraged Impacket’s wmiexec.py to execute commands with a semi-interactive she will,T1047
interacts with remote endpoints via WMI,T1047
a number of WMI requests via DCERPC from one endpoint to a target endpoint based on the ports.,T1047
the ‘Powershell.exe’ process initiated the WMI requests.,T1047
One of the observed commands invoked via WMI was ‘firefox.exe’.,T1047
"The commands executed included directory traversal,",T1083
Tool Used to Steal Sensitive Information,T1005
proxying the traffic,T1090
initiating a proxied,T1090
Several HTTP Post events were observed to the identified domains,T1071.001
HTTP stream containing the content,T1071.001
The POST event included a MIME part indicating file upload,T1071.001
The file that was uploaded 775E.bin was deleted by the injected ‘Explorer.exe’ process from the target endpoint,T1027
The threat actor was able to RDP to a backup server using the admin credentials they acquired.,T1078
"This script called a combination of QueueUserAPC, GetCurrentThreadId, OpenThread, and VirtualAlloc to perform process injection of shellcode",T1055
shellcode stored in Base64.,T1027
a 200+MB padded file,T1027
padding the contents with benign data,T1027
"It included a standalone file padded with over 200MB of blank spaces, likely to impede analysis of the decompressed ISO file.",T1027
executes a CMD file,T1059.003
The CMD file contains commands,T1059.003
which use certutil (renamed here as slaughterhouse.exe) to decode,T1140
The decoded DLL,T1140
thus requires two rounds of decoding using certutil.,T1140
chaining together a series of scripts to decode,T1140
The victim double clicks the ISO to mount it,T1204.002
"Victims can be lured into clicking executable content including binaries, scripts or shortcut files masquerading as benign filetypes such as PDFs or folders.",T1204.002
DLL is then executed using rundll32,T1218.011
and injects Qakbot into wermgr.exe.,T1055
"This file is base64 twice,",T1027
or unpack the final payload,T1027
"modifies registry keys to maintain persistence,",T1112
Modifies the Windows registry,T1112
modifies the Windows Registry to allow remote desktop connections,T1112
establishes persistence through the creation of two keys in CurrentVersion\Run.,T1547.001
Creates registry key for persistence only,T1547.001
Creates two registry keys for persistence,T1547.001
Keys found in CurrentVersion\Run contain references to programs that will execute when a user logs in.,T1547.001
operators install and execute remote access tools such as Splashtop on targeted systems.,T1219
remote monitoring and management (RMM) software,T1219
operators use Splashtop to transfer malicious tools from computer to computer in the victim’s environment.,T1570
It copies other malicious batch and EXE files from a compromised internal Server Message Block (SMB) server to the newly created temp folder,T1570
operators utilize RDP to move laterally in the victim’s environment.,T1021.001
Modifies the Windows registry to allow remote desktop connections.,T1021.001
operators open up an Remote Desktop Protocol (RDP) port,T1021.001
operators use Mimikatz to dump passwords.,T1003.001
operators use Mimikatz to dump passwords from LSASS.,T1003.001
"Mimikatz, which is a tool used for extracting sensitive information such as passwords and authentication credentials from a Windows operating system.",T1003.001
"Mimikatz being leveraged maliciously by threat actors in the following ways: Credential Loading Mimikatz loads credentials from various sources such as Windows memory, Local Security Authority Subsystem Service (LSASS) process",T1003.001
"Mimikatz allows the user to manipulate the dumped credentials,",T1003.001
"is a small, UPX-packed password protected binary",T1027
This version of Mimikatz has been compressed using UPX,T1027
"While UPX is often legitimately used to reduce file size, we have observed threat actors utilizing UPX and other packing programs to evade static detection of the underlying payload.",T1027
operators use UPX to pack DC2.exe and DC4.exe to avoid static signature detection.,T1027
the batch file makes the following changes to the system,T1059.003
executes an embedded batch file.,T1059.003
is a batch script,T1059.003
is a batch script that creates a new user,T1059.003
"creates a batch script that,",T1059.003
creates a batch script,T1059.003
Disables the User Account Control (UAC),T1548.002
Attempting to use sc stop and taskkill to stop over 100 services related to various areas ranging from remote desktop tools to Windows Defender,T1562.001
"The HTML code in this file contains embedded JavaScript functionality,",T1027
cleanup script used to remove evidence of the attack on a system,T1027
cleanup scripts from other threat actors are usually smaller and more specific to the tools used by that actor.,T1027
adds an additional layer of obfuscation to the code,T1027
password-protected executables to obfuscate malware,T1027
"operators delete files such as mim.exe, mim32.exe, zam.exe and zam.bat to cover their tracks",T1070.004
hid the installer for Advanced Port Scanner within Inno Setup installer to evade static signature detection.,T1027
employs a forged document linked to G7 to target various governments within the G20 forum.,T1566.001
spam email comprising an attached MS Office document,T1566.001
employ the remote template injection method to retrieve the next stage of the malware from the TA’s Command-and-Control (C&C) server.,T1055
download of a new payload from the attacker’s remote server,T1105
download a backdoor module.,T1105
downloads and executes a malicious backdoor,T1105
enables the TAs to create customized documents containing embedded objects that exploit vulnerabilities in Microsoft Word’s Equation Editor,T1027
"drops an embedded payload, which is a DLL file",T1027
includes both an encrypted payload and shellcode,T1027
encrypts the collected information using RC4 encryption with the key “xkYgv127” and encodes it using base64.,T1027
proceeds to decrypt,T1140
"scheduled task entry,",T1053.005
executes the export function “StartA” from the DLL,T1106
using rundll32.exe,T1218.011
utilizing the “rundll32.exe” command,T1218.011
loader is executed through rundll32.exe,T1218.011
"hostname, operating system name, OS version, username,",T1082
"Gather computer-specific information such as computer name, username, gateway address, network adapter details, Windows version, and user type",T1082
"Internet information,",T1016
Retrieve TCP/UDP tables,T1016
the presence of any installed anti-virus software on the machine.,T1518.001
encrypted data is then exfiltrated using the below C&C URL,T1041
encrypted data is then exfiltrated using the below C&C URL,T1573.001
C&C server responds with the next stage executable,T1573.001
