text,label
These emails may contain a malicious link or files that will provide the cyber actor access to the victim’s device,T1566.001
These emails may contain a malicious link or file that provide the cyber actor access to the victim’s device,T1566.001
after the user clicks on the malicious link or opens the attachment.,T1204.002
the user clicks on the malicious link or opens the attachment.,T1204.002
"gaining credential access into victim networks by using legitimate, but compromised credentials to access OWA servers, corporate login portals, and victim networks.",T1078
"cyber actors used valid accounts to log into a service specifically designed to accept remote connections,",T1078
The actor may then perform actions as the logged-on user.,T1078
"cyber actors used valid accounts to log into a service specifically designed to accept remote connections,",T1078
The actor may then perform actions as the logged-on user.,T1078
"Using cmd.exe,",T1059.003
Windows Command She Will,T1059.003
or command line interface tools,T1059.003
executing malware shellcode and batch files,T1059.003
such as schtask or crontab to create and schedule tasks that enumerate victim devices and networks.,T1053.005
to establish new services to enable persistence.,T1543.003
cyber actors have also been observed modifying group policies for password exploitation.,T1484.001
usage of Mimikatz,T1003.001
observed targeting the LSASS process or Active directory (NDST.DIT) for credential dumping.,T1003.001
"Injecting into the rundll32.exe process to hide usage of Mimikatz, as well as injecting into a running legitimate explorer.exe process for lateral movement.",T1055
Using shellcode that injects implants into newly created instances of the Service Host process (svchost),T1055
were observed using the 7-Zip utility to unzip imported tools and malware files onto the victim device.,T1140
cyber actors have been observed deleting files using rm or del commands.,T1070.004
cyber actors were observed Base64 encoding files and command strings to evade security measures.,T1027
have been observed using Base-64 encoded commands,T1027
"were observed using Microsoft signed binaries, such as Rundll32, as a proxy to execute malicious payloads.",T1218.011
"have been observed using commands, including tasklist, jobs, ps, or taskmgr, to reveal the running processes on victim devices.",T1057
cyber actors also used on-premises Identity and Access Management (IdAM) and federation services in hybrid cloud environments in order to pivot to cloud resources.,T1078
cyber actors also used on-premises Identity and Access Management (IdAM) and federation services in hybrid cloud environments in order to pivot to cloud resources.,T1078
cyber actors used RDP,T1021.001
cyber actors have been observed using the mv command to export files into a location,T1074.001
a downloader that downloads and executes a payload,T1105
cyber actors have been observed importing tools from GitHub or infected domains to victim networks,T1105
cyber actors used the Server Message Block (SMB) protocol to import tools into victim networks.,T1570
it also tries to delete the wp-sale.js file,T1070.004
obfuscated PHP code (again using character code obfuscation):,T1027
a heavily obfuscated script,T1027
obfuscated JavaScript code,T1027
When decoded,T1140
"When decoded, a backdoor is revealed",T1140
sent as a POST request,T1071.001
This backdoor executes arbitrary PHP code sent in POST request parameters.,T1071.001
actors disable antivirus software,T1562.001
the threat actor deactivated antivirus protocols,T1562.001
after receiving phishing emails containing malicious PDF documents [T,T1566.001
for initial access is RDP compromise.,T1021.001
actors often use RDP to move laterally across the network,T1021.001
download multiple tools,T1105
actors gain initial access through exploiting public-facing applications,T1190
PsExec has also been used to aid lateral movement,T1570
actors used a legitimate admin account to remotely log on to the domain controller,T1078
by modifying Group Policy Objects,T1484.001
force a group policy update,T1484.001
delete files upon completion—including,T1070.004
numerous batch (.bat) files on impacted systems,T1059.003
Batch files create a new admin user,T1059.003
which are typically transferred as an encrypted 7zip file.,T1027
These strings are passed to a decoding function where they are converted from hex to byte and XOR’d with decimal 18.,T1140
the decoded strings,T1140
Once decoded,T1140
Base64 decodes the payload content,T1140
to decode the second buffer using key 58 3E 88 D0,T1140
decoded by Shellcode,T1140
These strings are passed to a de-obfuscation function,T1140
PowerShell de-obfuscation routine,T1140
this shellcode is responsible for fetching Remcos RAT,T1105
used to retrieve a payload package containing the second stage PowerShell and two shellcode buffers,T1105
retrieves a decoy tax document and VBS script.,T1105
copying the current process command line as a new argument,T1059.003
full command line argument,T1059.003
a single payload package is retrieved that contains both the two-stage shellcode,T1027
highly obfuscated commands and encrypted shellcode.,T1027
The PowerShell command contains various obfuscated strings,T1027
inject Remcos RAT into a legitimate Windows process such as ieinstal.exe.,T1055
injecting it into ieinstall.exe,T1055
execution begins with the user clicking on a shortcut file,T1204.002
executed by the user clicking a shortcut file,T1204.002
enticing users to click on malicious shortcut files,T1204.002
checks if the system is 64-bit,T1082
remote access and surveillance features,T1219
keylogging,T1056.001
screenshots,T1113
highly obfuscated and contains junk code to impede analysis.,T1027
The script concatenates hundreds of smaller strings into a single variable which ultimately builds and executes,T1027
The payload would then be decrypted through XOR,T1140
use a set of tools via remote desktop,T1021.001
the ransomware drops a batch file,T1059.003
to steal system information like machine details,T1082
the payload most likely arrives by exploiting public-facing websites and domains.,T1190
targeted vulnerabilities in Microsoft SQL (MS SQL) Server for initial access,T1190
"the payload downloaded by the PowerShell script was a .NET downloader, which would subsequently retrieve an encrypted payload from the command-and-control (C&C) server",T1105
used different sets of defense evasion and reconnaissance tools such as GMER and Advance Process Termination to manually uninstall antivirus products on the target system.,T1562.001
to terminate security-related processes and services by dropping KILLAV,T1562.001
the threat actors who perform brute-force attacks on MS SQL Servers.,T1110
"executed a spam campaign with malicious OneNote file attachments,",T1566.001
The initial attack phase involves infiltrating Internet-facing Microsoft Exchange servers,T1190
The malware implemented a series of Mimikatz modifications on closed-source tooling,T1003.001
staging a credential theft capability in the LSASS process itself by abusing native Windows capabilities,T1003.001
"In order to steal credentials, the attackers employ custom modified versions of Mimikatz",T1003.001
stealing credentials from the Local Security Authority Subsystem Service (LSASS) process.,T1003.001
"This call instructs LSASS to load and execute pc.dll, which then stages the getHashFlsa64.dll credential theft component.",T1003.001
accesses the memory of its host LSASS process and stores stolen credentials in a Mimikatz log file,T1003.001
of a Security Package into LSASS using RPC calls.,T1003.001
steals credentials from LSASS,T1003.001
The threat actors used C:\MS_DATA as their main working directory for storing malware and staging data for exfiltration,T1074.001
and Remote Desktop user sessions.,T1021.001
"""cmd"" /c",T1059.003
"cmd"" /c",T1059.003
"cmd"" /c",T1059.003
"cmd"" /c",T1059.003
"""cmd"" /c",T1059.003
"""cmd"" /c",T1059.003
"""cmd"" /c",T1059.003
"""cmd"" /c",T1059.003
"""cmd"" /c",T1059.003
"""cmd"" /c",T1059.003
"""cmd"" /c",T1059.003
"""cmd"" /c",T1059.003
"""cmd"" /c",T1059.003
"They also retrieve networking information, like network adapters, specific machines, and network services like Remote Desktop Protocol (RDP).",T1016
"For lateral movement, the attackers made use of the PsExec tool and the net use command for accessing shared resources on remote machines.",T1570
and the PsExec Windows Sysinternals tool and net for lateral movement and exploration,T1570
loads and executes the decrypted,T1140
pc.exe decrypts AddSecurityPackage64.dll and pc.dll using the AES encryption algorithm,T1140
"pc.dll decrypts,",T1140
Disabling Windows event logging in an attempt to evade detection,T1562.001
"In an attempt to remain undetected, AddSecurityPackage64.dll disables Windows event logging by killing threads of the Windows Event Log service without stopping the execution of the service itself",T1562.001
Injecting pc.dll into LSASS as a Security Package,T1055
to execute malicious code in the context of LSASS.,T1055
"enumerating the processes’ threads,",T1057
tasklist,T1057
informationAddSecurityPackage64.dll injects pc.dll into LSASS by deploying pc.dll as a Security Package,T1055
embedded JavaScript Observed Notation (JSON)-based configuration to set parameters,T1027
text-encoded in base64,T1027
brute-force attacks,T1110
brute-forcing and compromising servers,T1110
Valid credentials,T1078
"uploaded to the command-and-control (C&C) server,",T1041
usually at port 5028/TCP,T1095
use several highly obfuscated and underdevelopment custom loaders,T1027
malicious RAR archive,T1027
install an information stealer.,T1005
"stealer,",T1005
keylogger with logging capabilities using the Telegram API,T1056.001
distributed to victims via phishing attempts,T1566.001
embedded binary files,T1027
"archive contains the files,",T1140
"deobfuscate, decompress,",T1140
decrypts strings,T1140
"deobfuscation, and decompression",T1140
decompressing,T1140
"decompresses it using the GZipStream API,",T1140
masquerades as a legitimate word document,T1036.005
legitimize the package in the eyes of the victim,T1036.005
designed to lure unsuspecting victims into executing the loader.,T1204.002
is executed by the victim,T1204.002
utilizes Telegram for delivering payloads,T1105
download,T1105
used to send program execution DEBUG and Telegram to deliver payloads and send commands.,T1105
downloads the next part,T1105
"utilizes Telegram for delivering payloads, sending commands, and receiving the payload heartbeat.",T1095
send commands.,T1095
sends a request to the attacker-controlled Telegram channel,T1095
"sends the message ""bot getted"" to the debug server.",T1095
"accepts commands from a Telegram channel,",T1095
"message to both the Debug server and the Telegram channel,",T1095
sends a GET request to https://api[.]telegram[.]org/bot{token}/getUpdates to retrieve the command,T1095
API hashing,T1027
resolves hashed Windows APIs,T1027
conceal the utilization of potentially suspicious APIs (functions) from static detection,T1027
"replacing the human-readable names of functions (such as ""CreateMutexW"") with a hash value,",T1027
used in the code to call the corresponding API function,T1027
employs dynamic API resolving to conceal its API imports,T1027
"storing the names or hashes of the APIs needed, then importing them dynamically at runtime.",T1027
"passes two arguments to the ""mw_resolveAPI"" function.",T1027
resolves the given API hash and retrieves the address of an exported function,T1027
creating a hash for each export function name,T1027
"string encryption,",T1027
irrelevant code,T1027
LoadLibrary and GetProcAddress functions,T1106
Compressapi,T1106
GetTokenInformation API.,T1106
retrieves the MachineGuid of the infected system from the SOFTWARE\Microsoft\Cryptography\MachineGuid registry key,T1012
"retrieves the MachineGuid of the infected system from the ""SOFTWARE\Microsoft\Cryptography\MachineGuid"" registry key.",T1012
deletes the HKCU\SOFTWARE\Intel registry key and recreates it,T1112
collects information about the .NET Framework Setup,T1082
elevate its privileges by executing the mw_UAC_bypass function,T1548.002
Calling Local Windows RPC Servers from .NET,T1548.002
bypass user account control (UAC) using only two remote procedure call (RPC) requests,T1548.002
"executes an export function called ""Entry"" from UpdateTask.dll via rundll32.exe",T1218.011
payload through rundll32.exe,T1218.011
disable Microsoft Defender,T1562.001
patch the integrity level of the Microsoft defender (MsMpEng.exe) and forcibly reduce it from system to untrusted integrity.,T1562.001
determine if it is running as an account with administrator privileges or simply as a regular user,T1033
creating scheduled tasks,T1053.005
sets up its working directory,T1074.001
collect system information and steals user information,T1074.001
"tokens, and passwords from various web browsers and applications",T1078
captures screenshots,T1113
compressed and exfiltrated to the attacker via Telegram,T1041
"some strings, such as web browser paths and Geolocation API services URLs, are encrypted with the AES algorithm in cipher-block chaining (CBC) mode",T1573.001
"gathers basic system information,",T1082
for the infected system by gathering the username and hostname,T1082
"the malware then proceeds to gather basic system information, including username, computer name, and OS version,",T1082
"System info, including both hardware and OS info.",T1082
Collection of information about the system in HTML format,T1082
and hostname,T1082
"gathers basic system information, which it then sends to the C2,",T1041
send a list of process names and IDs back to the C2,T1041
the system information gathered by Domino Backdoor and sent to the C2,T1041
in return receives an AES encrypted payload.,T1027
uses a custom algorithm which XOR’s multiple values together.,T1027
which is stored immediately before the encrypted config block.,T1027
"The malware generates a random 32-byte key, which it encrypts using the RSA key.",T1027
loading an encrypted payload from its resources,T1027
The Microsoft WinCrypt library is used for AES encryption and,T1027
the encrypted config.,T1027
be based on an encryption algorithm used previously in,T1027
by gathering the username and,T1033
"to gather basic system information, including username,",T1033
is generated from the system username,T1033
used a similar XOR-based algorithm as part of its encryption mechanisms during communication with the C2.,T1573.001
"then proceeds to gather basic system information, including username, computer name, and OS version, which it then encrypts using AES-256-CBC and the generated,",T1573.001
then sends the AES-encrypted system data.,T1573.001
This data is then encrypted using AES and returned to the C2.,T1573.001
the decrypted config contains two pipe-delimited IP addresses,T1140
and decrypts them using XOR and the key,T1140
"The malware then proceeds to decrypt its configuration block,",T1140
The config is decrypted using XOR and a 16-byte key,T1140
"A second config block, which is decrypted separately",T1140
The decrypted data consists of a 4 byte size,T1140
The malware then decrypts the received payload using AES and the shared key.,T1140
which decrypts to the following 5 bytes,T1140
decrypting it using AES-256-CBC and a hardcoded key.,T1140
"The decrypted data consists of 4 bytes containing the payload size,",T1140
The Microsoft WinCrypt library is used for AES encryption and decryption by both,T1140
is decrypted using XOR and a 16-byte key,T1140
executes the decrypted shellcode,T1140
loads the resources using the API calls LdrFindResource_U and LdrAccessResource,T1106
and execute the file using CreateProcessA.,T1106
"utilising similar API calls,",T1106
the malware enumerates the running processes on the system and compiles a list of process names and IDs.,T1057
enumerate running processes and send a list of process names and IDs back to the C2,T1057
Enumerates running processes,T1057
the loader allocates memory within the current process and then loads the PE payload into it using the full PE loading procedure.,T1055
"It copies the headers, maps the individual PE sections, processes any relocations, loads the PE’s imports, and then executes the PE from its internally specified entry point.",T1055
"passes the PE payload to it, which the shellcode then loads and executes.",T1055
Enumerate files on desktop,T1083
Enumerates files under Steam application directory,T1083
looping through entries under registry key,T1012
"waits for data collection tasks to complete,",T1005
"creating a hash of the collected data, to which it then appends its current process id.",T1005
uploads data to the C2 via a HTTP POST request,T1071.001
http/https data transfer,T1071.001
Self-delete after sending data,T1070.004
It then attempts to connect to the C2 via TCP port 443,T1095
"ranswomare for Windows can self-propagate in the local area network using the legitimate PsExec utility (contained in its body), which creates a temporary system service.",T1569.002
Legitimate accounts obtained by the attackers can be used to ensure persistence in the compromised infrastructure.,T1078
may use stolen legitimate accounts specified in the configuration data.,T1078
uses the command she will to run appropriate commands,T1059.003
an additional BAT file contained in the body of the ransomware.,T1059.003
"The attackers may use wmic to obtain information and run various commands,",T1047
They may also use the wmiexec module from Impacket to execute commands and move across the network.,T1047
uses wmic to obtain the,T1047
ransomware uses Native API.,T1106
the function CreateProcessWithLogonW.,T1106
"affiliates may exploit group policies, which results in a scheduled task being created (on each host) that launches the ransomware.",T1053.005
disabling security tools,T1562.001
"To prevent being detected, the attackers end processes and services related to security and antivirus software.",T1562.001
"To bypass UAC, BlackCat ransomware may escalate privileges using the ICMLuaUtil COM interface, as well as use the Masquerade PEB method.",T1548.002
"Bypass User Account Control;The attackers may bypass UAC using the ICMLuaUtil COM interface, as well as use the Masquerade PEB method.",T1548.002
decrypts configuration data as well as decrypts and unpacks the legitimate PsExec utility,T1140
unpacks the legitimate PsExec utility,T1027
ransomware uses obfuscation.,T1027
use a SoftPerfect Network Scanner executable renamed to svchost.exe.,T1036.005
uses PsExec to modify the system registry parameter MaxMpxCt,T1112
"To obtain authentication data, the attackers may dump the LSASS process using legitimate tools (procdump, comsvcs.dll).",T1003.001
"To obtain authentication data from the registry and files, the attackers may use NirSoft utilities.",T1552.001
"The attackers enumerate drives, directories, and files",T1083
to search for sensitive information for exfiltration purposes.,T1005
The attackers collect information from the local system for exfiltration purposes.,T1005
The attackers may use RDP to move across the network.,T1021.001
uses wmic to obtain the UUID of the compromised host.,T1082
enumerates all running processes,T1057
can self-propagate in the network by using the legitimate PsExec utility,T1570
to search for ones relating to security,T1518.001
enumerates system services to search for ones relating to security,T1518.001
"Before exfiltration, the attackers may put collected data in 7Zip archives.",T1074.001
"Remote access tools used by the attackers may use application layer protocols (HTTP, HTTPS,",T1071.001
"When the attackers use Cobalt Strike, the collected information may be sent via Cobalt Strike server communication channels.",T1041
"To remotely access the compromised infrastructure, the attackers may use the legitimate tools TeamViewer and ScreenConnect.",T1219
"To remotely access the compromised infrastructure, the attackers may use Cobalt Strike, TeamViewer and ScreenConnect",T1219
which perform asymmetric/symmetric encryption of the C&C server communication channel.,T1573.001
the attackers copy tools necessary for deployment to the compromised host.,T1105
the malware executes a command to delete itself from the system,T1070.004
delete key files,T1070.004
"attackers have been seen using several methods to distribute the wiper through the domain, like: domain Group Policy Object (GPO)",T1484.001
installs the payload as a service,T1543.003
sets a hardcoded list of system directories,T1083
system directories are targeted,T1083
enumerates their partitions.,T1083
an obfuscated .NET program.,T1027
WMI,T1047
to identify where the Operative System is stored in the disk,T1082
Application-level protocol,T1071.001
sends the output of ipconfig in a POST request,T1071.001
the opening of a URL file extracted from the archive.,T1071.001
output of ipconfig was sent to one of two addresses,T1071.001
Application-level protocol,T1071.001
a GET request is sent to the C2 server.,T1071.001
application-level messages from the server to the client is sent as the body of an HTTP response,T1071.001
are sent using separate POST requests.,T1071.001
sends an HTTPS request,T1071.001
same IP address was used as C2 server,T1071.001
domains give attackers the ability to mask malicious traffic as legitimate activity within the company,T1071.001
HttpConnector and HttpBindConnector are HTTP client with support for proxy and HTTP server.,T1071.001
HTTP and HTTPS are supported,T1071.001
HTTP with long polling,T1071.001
connect by sending a GET request to a URL from the configuration and provide a special cookie value,T1071.001
sends GET requests with pull operations.,T1071.001
POST request with push operation,T1071.001
Application-level protocol,T1071.001
use HTTP/HTTPS for C2 connections,T1071.001
An encrypted resume,T1027
archive,T1027
archive contains a bait PDF document,T1027
XOR encrypted with a 16-byte key,T1027
obfuscated with VMProtect,T1027
additional XOR encryption with the key,T1027
AES-128-CBC for encryption.,T1027
hashed with MD5,T1027
use AES-128 in CFB mode as the encryption algorithm,T1027
encrypted with the algorithm,T1027
a RAR archive,T1027
distributed in a RAR archive,T1027
ROR-13 hash,T1027
re-encrypted and saved in the same location,T1027
encrypted header,T1027
encrypted Base64 string containing the session GUID,T1027
compressed with GZip prior to encryption,T1027
are obfuscated with VMProtect,T1027
obfuscated,T1027
obfuscated code,T1027
is encrypted in the file,T1027
is re-encrypted,T1027
has been obfuscated with the same rel_jmp and fake-jb techniques,T1027
SFX archive,T1027
SFX archive,T1027
RAR and SFX-RAR files,T1027
plus the folder,T1027
"malicious archive,",T1027
located in the data sections,T1027
shellcode is located in a PE file overlay.,T1027
(encrypted) shellcode,T1027
consists of two .exe files.,T1027
contains three identical executable files,T1027
contains just one file:,T1027
which is also embedded inside the CHM file,T1027
three sections are extracted,T1027
malicious shortcuts,T1036.005
Web lnks with two shortcuts:,T1036.005
copies the payload to the folder C:\Users\Public\Downloads,T1036.005
PDF documents with a CV and IELTS certificate,T1036.005
the folder C:\Users\Public,T1036.005
copied to the folder %appdata%\Microsoft\AddIns\,T1036.005
into the folder c:\programdata,T1036.005
folder c:\programdata,T1036.005
trying to open either of the shortcuts,T1204.002
If the user opens it directly,T1204.002
"tries to make users run malicious .lnk, .chm, and .exe files",T1204.002
"running a command that extracts a Base64-encoded CAB archive from the body of the LNK file,",T1140
archive is unpacked to a temporary folder.,T1140
an extracted JS script,T1140
extract shellcode,T1140
decrypts the string,T1140
used for decryption:,T1140
is unpacked,T1140
unpacks,T1140
encrypted portion of the data is decrypted,T1140
is decrypted,T1140
decryption and decompression,T1140
decryption,T1140
decodes it into shellcode with Base64,T1140
decrypt,T1140
uses a custom PL format with encryption,T1140
adding itself to the startup folder,T1547.001
"writes the file svchost.bat, which transfers control to winness.exe, to the startup folder",T1547.001
persists by means of a registry run key or a startup folder,T1547.001
"adding a scheduler task,",T1053.005
creates a task with schtasks for persistence,T1053.005
that all three intermediate C2 servers,T1090
possible proxy servers (any indicated in the configuration plus system proxies) and C2 servers,T1090
domains give attackers the ability to mask malicious traffic as legitimate activity within the company,T1090
proxy server,T1090
proxy,T1090
– proxy server address and credentials,T1090
proxy server,T1090
collects and sends system information,T1005
OS uptime,T1082
Operating system version and whether it is 32-bit or 64-bit,T1082
Computer name Name of running module PID,T1082
Shellcode version and whether it is 32-bit or 64-bit,T1082
Whether the OS is 32-bit or 64-bit,T1082
Computer name,T1082
collect information about the computer name and OS version and whether it is 32-bit or 64-bit,T1082
Network adapter IP addresses MAC address of one of the adapters,T1016
List of IP addresses,T1016
MAC addresses of network adapters,T1016
Collects the configuration of active connector instances other than the RPCConnector and RPCBindConnector classes.,T1016
